{
  "event_id": "EVT-U1B-2025-0312",
  "asset_id": "CHK-SW-HX-07A",
  "timestamp_start": "2025-03-12T08:14:00Z",
  "timestamp_end": "2025-03-12T08:44:00Z",
  "event_type": "DEGRADATION",
  "severity": "HIGH",
  "trigger_source": "surveillance_test",
  "symptom_signature": {
    "description": "Service water check valve CHK-SW-HX-07A (model GWB-250-SS-316, EDG HX-07A Train A supply) found leaking through at 0.42 gpm during quarterly flow balance surveillance (WO-2025-SW-0147). Acceptance criterion is < 0.10 gpm. This is the third leakthrough failure of the same valve model across SW Train A and Train B in 18 months. No real-time alarm or process anomaly preceded the surveillance finding; degradation was not detectable by continuous monitoring.",
    "anomaly_pattern": "sustained_exceedance",
    "symptom_types": [
      "leakage",
      "flow"
    ],
    "affected_parameters": [
      {
        "parameter": "sw_leakthrough_rate",
        "sensor_id": "U1B-FT-2204",
        "observed_value": 0.42,
        "unit": "gpm",
        "normal_range": {
          "min": 0.0,
          "max": 0.1
        }
      }
    ]
  },
  "related_cr_ids": [
    "CR-2023-11-847",
    "CR-2024-04-219"
  ],
  "initial_assessment": "Third leakthrough failure of valve model GWB-250-SS-316 in 18 months. Prior CAP entries closed at proximate cause only. Recurrence pattern suggests deeper causal contributors beyond normal wear.",
  "rca_required": true
}